[
  {
    "id": "biz_partner_intro",
    "category": "CAREER",
    "art": null,
    "tags": [
      "business",
      "chain"
    ],
    "cooldown": 18,
    "choices": [
      {
        "effects": {
          "cashChange": -3000,
          "statChanges": {
            "stress": 5,
            "networking": 4
          },
          "messageKey": "events.biz_partner_intro.choices.0.message"
        },
        "followups": [
          {
            "id": "biz_partner_scaling",
            "delayMonths": 2
          }
        ],
        "labelKey": "events.biz_partner_intro.choices.0.label"
      },
      {
        "effects": {
          "cashChange": 0,
          "statChanges": {
            "happiness": 2
          },
          "messageKey": "events.biz_partner_intro.choices.1.message"
        },
        "labelKey": "events.biz_partner_intro.choices.1.label"
      }
    ],
    "titleKey": "events.biz_partner_intro.title",
    "descriptionKey": "events.biz_partner_intro.description"
  },
  {
    "id": "biz_partner_scaling",
    "category": "CAREER",
    "art": null,
    "tags": [
      "business",
      "chain"
    ],
    "cooldown": 18,
    "choices": [
      {
        "effects": {
          "cashChange": -8000,
          "statChanges": {
            "stress": 8
          },
          "messageKey": "events.biz_partner_scaling.choices.0.message"
        },
        "followups": [
          {
            "id": "biz_partner_dispute",
            "delayMonths": 3
          }
        ],
        "labelKey": "events.biz_partner_scaling.choices.0.label"
      },
      {
        "effects": {
          "cashChange": -3000,
          "statChanges": {
            "stress": 2
          },
          "messageKey": "events.biz_partner_scaling.choices.1.message"
        },
        "labelKey": "events.biz_partner_scaling.choices.1.label"
      },
      {
        "effects": {
          "cashChange": 0,
          "statChanges": {
            "stress": -3
          },
          "messageKey": "events.biz_partner_scaling.choices.2.message"
        },
        "labelKey": "events.biz_partner_scaling.choices.2.label"
      }
    ],
    "titleKey": "events.biz_partner_scaling.title",
    "descriptionKey": "events.biz_partner_scaling.description"
  },
  {
    "id": "biz_partner_dispute",
    "category": "LEGAL",
    "art": null,
    "tags": [
      "business",
      "chain"
    ],
    "cooldown": 18,
    "choices": [
      {
        "effects": {
          "cashChange": -10000,
          "statChanges": {
            "stress": -5,
            "happiness": 2
          },
          "messageKey": "events.biz_partner_dispute.choices.0.message"
        },
        "labelKey": "events.biz_partner_dispute.choices.0.label"
      },
      {
        "effects": {
          "cashChange": -2000,
          "statChanges": {
            "stress": 3
          },
          "messageKey": "events.biz_partner_dispute.choices.1.message"
        },
        "labelKey": "events.biz_partner_dispute.choices.1.label"
      },
      {
        "effects": {
          "cashChange": 12000,
          "statChanges": {
            "happiness": -4
          },
          "messageKey": "events.biz_partner_dispute.choices.2.message"
        },
        "labelKey": "events.biz_partner_dispute.choices.2.label"
      }
    ],
    "titleKey": "events.biz_partner_dispute.title",
    "descriptionKey": "events.biz_partner_dispute.description"
  },
  {
    "id": "health_checkup",
    "category": "MEDICAL",
    "art": null,
    "tags": [
      "health",
      "chain"
    ],
    "cooldown": 12,
    "choices": [
      {
        "effects": {
          "cashChange": -2000,
          "statChanges": {
            "stress": -2,
            "health": 2
          },
          "messageKey": "events.health_checkup.choices.0.message"
        },
        "followups": [
          {
            "id": "health_claim",
            "delayMonths": 3
          }
        ],
        "labelKey": "events.health_checkup.choices.0.label"
      },
      {
        "effects": {
          "cashChange": 0,
          "statChanges": {
            "stress": 1
          },
          "messageKey": "events.health_checkup.choices.1.message"
        },
        "followups": [
          {
            "id": "health_emergency",
            "delayMonths": 2
          }
        ],
        "labelKey": "events.health_checkup.choices.1.label"
      }
    ],
    "titleKey": "events.health_checkup.title",
    "descriptionKey": "events.health_checkup.description"
  },
  {
    "id": "health_claim",
    "category": "MEDICAL",
    "art": null,
    "tags": [
      "health",
      "chain"
    ],
    "cooldown": 12,
    "choices": [
      {
        "effects": {
          "cashChange": 4000,
          "statChanges": {
            "stress": -4
          },
          "messageKey": "events.health_claim.choices.0.message"
        },
        "labelKey": "events.health_claim.choices.0.label"
      },
      {
        "effects": {
          "cashChange": -3000,
          "statChanges": {
            "stress": -2
          },
          "messageKey": "events.health_claim.choices.1.message"
        },
        "labelKey": "events.health_claim.choices.1.label"
      }
    ],
    "titleKey": "events.health_claim.title",
    "descriptionKey": "events.health_claim.description"
  },
  {
    "id": "health_emergency",
    "category": "MEDICAL",
    "art": null,
    "tags": [
      "health",
      "chain"
    ],
    "cooldown": 12,
    "choices": [
      {
        "effects": {
          "cashChange": -6000,
          "statChanges": {
            "stress": 6
          },
          "messageKey": "events.health_emergency.choices.0.message"
        },
        "labelKey": "events.health_emergency.choices.0.label"
      },
      {
        "effects": {
          "cashChange": 0,
          "statChanges": {
            "stress": 10
          },
          "addLiability": {
            "name": "Medical Payment Plan",
            "balance": 7000,
            "originalBalance": 7000,
            "interestRate": 0.1,
            "monthlyPayment": 250,
            "type": "MEDICAL_DEBT"
          },
          "messageKey": "events.health_emergency.choices.1.message"
        },
        "labelKey": "events.health_emergency.choices.1.label"
      }
    ],
    "titleKey": "events.health_emergency.title",
    "descriptionKey": "events.health_emergency.description"
  },
  {
    "id": "landlord_screening",
    "category": "HOUSING",
    "art": null,
    "tags": [
      "landlord",
      "chain"
    ],
    "cooldown": 12,
    "choices": [
      {
        "effects": {
          "cashChange": -200,
          "statChanges": {
            "stress": 2
          },
          "messageKey": "events.landlord_screening.choices.0.message"
        },
        "followups": [
          {
            "id": "landlord_tenant_good",
            "delayMonths": 2
          }
        ],
        "labelKey": "events.landlord_screening.choices.0.label"
      },
      {
        "effects": {
          "cashChange": 0,
          "statChanges": {
            "stress": 1
          },
          "messageKey": "events.landlord_screening.choices.1.message"
        },
        "followups": [
          {
            "id": "landlord_tenant_issue",
            "delayMonths": 2
          }
        ],
        "labelKey": "events.landlord_screening.choices.1.label"
      }
    ],
    "titleKey": "events.landlord_screening.title",
    "descriptionKey": "events.landlord_screening.description"
  },
  {
    "id": "landlord_tenant_good",
    "category": "HOUSING",
    "art": null,
    "tags": [
      "landlord",
      "chain"
    ],
    "cooldown": 12,
    "choices": [
      {
        "effects": {
          "cashChange": 1500,
          "statChanges": {
            "stress": -3
          },
          "messageKey": "events.landlord_tenant_good.choices.0.message"
        },
        "labelKey": "events.landlord_tenant_good.choices.0.label"
      },
      {
        "effects": {
          "cashChange": 800,
          "statChanges": {
            "happiness": 3
          },
          "messageKey": "events.landlord_tenant_good.choices.1.message"
        },
        "labelKey": "events.landlord_tenant_good.choices.1.label"
      }
    ],
    "titleKey": "events.landlord_tenant_good.title",
    "descriptionKey": "events.landlord_tenant_good.description"
  },
  {
    "id": "landlord_tenant_issue",
    "category": "HOUSING",
    "art": null,
    "tags": [
      "landlord",
      "chain"
    ],
    "cooldown": 12,
    "choices": [
      {
        "effects": {
          "cashChange": 0,
          "statChanges": {
            "stress": 4
          },
          "messageKey": "events.landlord_tenant_issue.choices.0.message"
        },
        "followups": [
          {
            "id": "landlord_eviction",
            "delayMonths": 2
          }
        ],
        "labelKey": "events.landlord_tenant_issue.choices.0.label"
      },
      {
        "effects": {
          "cashChange": -800,
          "statChanges": {
            "stress": 2
          },
          "messageKey": "events.landlord_tenant_issue.choices.1.message"
        },
        "labelKey": "events.landlord_tenant_issue.choices.1.label"
      }
    ],
    "titleKey": "events.landlord_tenant_issue.title",
    "descriptionKey": "events.landlord_tenant_issue.description"
  },
  {
    "id": "landlord_eviction",
    "category": "LEGAL",
    "art": null,
    "tags": [
      "landlord",
      "chain"
    ],
    "cooldown": 12,
    "choices": [
      {
        "effects": {
          "cashChange": -2000,
          "statChanges": {
            "stress": 6
          },
          "messageKey": "events.landlord_eviction.choices.0.message"
        },
        "labelKey": "events.landlord_eviction.choices.0.label"
      },
      {
        "effects": {
          "cashChange": -1500,
          "statChanges": {
            "stress": 3
          },